Year,Title,Source,Link,Output,Task,Query,Structured,Cost,Model,Learning,Start,Stop,Others
2013,Towards the Supervised Machine Translation: Real Word Alignments and Translations in a Multi-task Active Learning process,ACL,https://aclanthology.org/2013.mtsummit-posters.6,"Complex_structured_prediction,Generation","Word_alignment,MT","Uncertainty,Density,Hybrid(simple)",Full,-,-,-,-,-,Multiple_targets
2013,Active Learning for Phenotyping Tasks,ACL,https://aclanthology.org/W13-5101,Classification,Classification,Uncertainty,-,-,-,-,-,-,-
2013,Annotating named entities in clinical text by combining pre-annotation and active learning,ACL,https://aclanthology.org/P13-3011,Sequence_labeling,NER,"Uncertainty,Others(special)",-,Directly_reducing_cost,-,-,-,-,-
2013,Online Active Learning for Cost Sensitive Domain Adaptation,ACL,https://aclanthology.org/W13-3501,Classification,Classification,"Uncertainty,Disagreement",-,-,-,Transfer_learning,-,-,Multiple_targets
2013,Analysis of Stopping Active Learning based on Stabilizing Predictions,ACL,https://aclanthology.org/W13-3502,Others,Others,Others,-,-,-,-,-,Stop,-
2013,Active Learning for Dependency Parsing by A Committee of Parsers,ACL,https://aclanthology.org/W13-5711,Complex_structured_prediction,Parsing,Disagreement,Partial,-,-,Semi_supervised,-,-,-
2012,Active Learning for Chinese Word Segmentation,ACL,https://aclanthology.org/C12-2067,Sequence_labeling,Segmentation,Uncertainty,Partial,-,-,-,-,-,-
2012,Active Learning for Imbalanced Sentiment Classification,ACL,https://aclanthology.org/D12-1013,Classification,Classification,"Uncertainty,Others(special)",-,-,-,-,-,-,Data_imbalance
2012,Active learning for interactive machine translation,ACL,https://aclanthology.org/E12-1025,Generation,MT,"Uncertainty,Discriminative",-,Directly_reducing_cost,-,-,-,-,-
2012,Active Learning for Coreference Resolution,ACL,https://aclanthology.org/N12-1055,Complex_structured_prediction,Coreference,Disagreement,Partial,-,-,-,-,-,-
2012,Active Learning and the Irish Treebank,ACL,https://aclanthology.org/U12-1005,Complex_structured_prediction,Parsing,Disagreement,-,Measurement,-,-,-,-,-
2012,Active Learning for Coreference Resolution,ACL,https://aclanthology.org/W12-2409,Complex_structured_prediction,Coreference,Uncertainty,Partial,-,-,-,-,-,-
2012,Exploring Label Dependency in Active Learning for Phenotype Mapping,ACL,https://aclanthology.org/W12-2418,Complex_structured_prediction,Others,Disagreement,-,-,-,-,-,-,-
2012,Active Learning with Transfer Learning,ACL,https://aclanthology.org/W12-3303,Classification,Classification,Uncertainty,-,-,-,Transfer_learning,-,-,-
2011,A Non-negative Matrix Factorization Based Approach for Active Dual Supervision from Document and Word Labels,ACL,https://aclanthology.org/D11-1088,Classification,Classification,Others(special),-,-,-,-,-,-,-
2011,Active Learning with Amazon Mechanical Turk,ACL,https://aclanthology.org/D11-1143,"Classification,Sequence_labeling","Classification,NER",Uncertainty,-,-,-,-,-,-,Crowdsourcing
2011,"Active Learning Strategies for Support Vector Machines, Application to Temporal Relation Classification",ACL,https://aclanthology.org/I11-1007,Classification,Relation,"Uncertainty,Density,Batch_diversity,Hybrid(simple),Hybrid(multi_step)",-,-,-,-,-,-,-
2011,Enhancing Active Learning for Semantic Role Labeling via Compressed Dependency Trees,ACL,https://aclanthology.org/I11-1021,Complex_structured_prediction,SRL,"Uncertainty,Density,Hybrid(simple)",-,-,-,-,-,-,-
2011,Evaluating the Impact of Coder Errors on Active Learning,ACL,https://aclanthology.org/P11-1005,Classification,WSD,Uncertainty,-,-,-,-,-,-,-
2011,Good Seed Makes a Good Crop: Accelerating Active Learning Using Language Modeling,ACL,https://aclanthology.org/P11-2002,Classification,WSD,Uncertainty,-,-,-,-,Seed,-,Data_imbalance
2011,"Pointwise Prediction for Robust, Adaptable Japanese Morphological Analysis",ACL,https://aclanthology.org/P11-2093,Sequence_labeling,Segmentation,Uncertainty,Partial,-,-,Transfer_learning,-,-,-
2011,Multi-Strategy Approaches to Active Learning for Statistical Machine Translation,ACL,https://aclanthology.org/2011.mtsummit-papers.12,Generation,MT,"Density,Discriminative,Hybrid(dynamic)",-,-,-,-,-,-,-
2011,Enlarging Monolingual Dictionaries for Machine Translation with Active Learning and Non-Expert Users,ACL,https://aclanthology.org/R11-1047,Complex_structured_prediction,Others,Others(special),-,-,-,-,-,-,-
2011,Assessing Benefit from Feature Feedback in Active Learning for Text Classification,ACL,https://aclanthology.org/W11-0313,Classification,Classification,Uncertainty,-,-,-,-,-,-,-
2011,Active Learning with Multiple Annotations for Comparable Data Classification Task,ACL,https://aclanthology.org/W11-1210,Complex_structured_prediction,Others,Uncertainty,-,-,-,-,-,-,Multiple_targets
2011,Active Learning for Dependency Parsing Using Partially Annotated Sentences,ACL,https://aclanthology.org/W11-2917,Complex_structured_prediction,Parsing,Uncertainty,Partial,-,-,-,-,-,-
2010,Bringing Active Learning to Life,ACL,https://aclanthology.org/C10-1107,Classification,WSD,Uncertainty,-,-,-,-,-,-,"AL_in_practice,Data_imbalance"
2010,A Comparison of Models for Cost-Sensitive Active Learning,ACL,https://aclanthology.org/C10-2143,Sequence_labeling,NER,Uncertainty,-,Cost_sensitive,-,-,-,-,-
2010,Active Deep Networks for Semi-Supervised Sentiment Classification,ACL,https://aclanthology.org/C10-2173,Classification,Classification,Uncertainty,-,-,-,Semi_supervised,-,-,-
2010,Discriminative Sample Selection for Statistical Machine Translation,ACL,https://aclanthology.org/D10-1061,Generation,MT,"Performance_prediction,Batch_diversity",-,-,-,-,-,-,-
2010,Active Learning and Crowd-Sourcing for Machine Translation,ACL,https://aclanthology.org/L10-1165,Generation,MT,"Density,Discriminative",-,-,-,-,-,-,Crowdsourcing
2010,Active Learning for Building a Corpus of Questions for Parsing,ACL,https://aclanthology.org/L10-1447,Complex_structured_prediction,Parsing,Uncertainty,Full,-,-,-,-,-,-
2010,Using Smaller Constituents Rather Than Sentences in Active Learning for Japanese Dependency Parsing,ACL,https://aclanthology.org/P10-1037,Complex_structured_prediction,Parsing,Uncertainty,Partial,-,-,-,-,-,-
2010,Bucking the Trend: Large-Scale Cost-Focused Active Learning for Statistical Machine Translation,ACL,https://aclanthology.org/P10-1088,Generation,MT,Discriminative,Partial,Measurement,-,-,AL_stage,Stop,-
2010,Phrase-Based Statistical Language Generation Using Graphical Models and Active Learning,ACL,https://aclanthology.org/P10-1157,Generation,Others,Uncertainty,-,-,-,-,-,-,-
2010,Active Learning-Based Elicitation for Semi-Supervised Word Alignment,ACL,https://aclanthology.org/P10-2067,Complex_structured_prediction,Word_alignment,"Uncertainty,Disagreement",Partial,-,-,-,-,-,-
2010,An Active Learning Approach to Finding Related Terms,ACL,https://aclanthology.org/P10-2068,Classification,Others,Others,-,-,-,-,-,-,-
2010,Active Learning for Constrained Dirichlet Process Mixture Models,ACL,https://aclanthology.org/W10-2809,Complex_structured_prediction,Others,Uncertainty,-,-,-,-,-,-,-
2010,Active Learning Based Corpus Annotation,ACL,https://aclanthology.org/W10-4121,Sequence_labeling,Others,Uncertainty,-,-,-,-,-,-,-
2010,Using Variance as a Stopping Criterion for Active Learning of Frame Assignment,ACL,https://aclanthology.org/W10-0101,Classification,Others,Uncertainty,-,-,-,-,-,Stop,-
2010,Active Semi-Supervised Learning for Improving Word Alignment,ACL,https://aclanthology.org/W10-0102,Complex_structured_prediction,Word_alignment,"Uncertainty,Disagreement",Partial,-,-,Semi_supervised,-,-,-
2010,D-Confidence: An Active Learning Strategy which Efficiently Identifies Small Classes,ACL,https://aclanthology.org/W10-0103,Classification,Classification,"Uncertainty,Discriminative",-,-,-,-,-,-,Data_imbalance
2010,Domain Adaptation meets Active Learning,ACL,https://aclanthology.org/W10-0104,Classification,Classification,"Uncertainty,Discriminative",-,-,-,Transfer_learning,-,-,-
2010,Parallel Active Learning: Eliminating Wait Time with Minimal Staleness,ACL,https://aclanthology.org/W10-0105,Sequence_labeling,POS,Uncertainty,-,Wait_time,-,-,-,-,-
2010,A Semi-Supervised Batch-Mode Active Learning Strategy for Improved Statistical Machine Translation,ACL,https://aclanthology.org/W10-2916,Generation,MT,"Uncertainty,Batch_diversity,Performance_prediction",-,-,-,-,-,-,-
2009,Active Learning by Labeling Features,ACL,https://aclanthology.org/D09-1009,Sequence_labeling,NER,Uncertainty,-,-,-,-,-,-,-
2009,How well does active learning actually work? Time-based evaluation of cost-reduction strategies for language documentation,ACL,https://aclanthology.org/D09-1031,Sequence_labeling,"Others,POS",Uncertainty,-,"Measurement,Cost_sensitive",-,-,-,-,-
2009,Active Learning for Statistical Phrase-based Machine Translation,ACL,https://aclanthology.org/N09-1047,Generation,MT,"Uncertainty,Density,Discriminative,Performance_prediction",-,-,-,-,-,-,-
2009,Taking into Account the Differences between Actively and Passively Acquired Data: The Case of Active Learning with Support Vector Machines for Imbalanced Datasets,ACL,https://aclanthology.org/N09-2035,Classification,"Classification,Relation",Uncertainty,-,-,-,-,-,-,Data_imbalance
2009,Active Zipfian Sampling for Statistical Parser Training,ACL,https://aclanthology.org/N09-2063,Complex_structured_prediction,Parsing,Others(special),-,-,-,-,-,-,-
2009,Active Learning for Multilingual Statistical Machine Translation,ACL,https://aclanthology.org/P09-1021,Generation,MT,Others(special),-,-,-,-,-,-,Multiple_targets
2009,"Mine the Easy, Classify the Hard: A Semi-Supervised Approach to Automatic Sentiment Classification",ACL,https://aclanthology.org/P09-1079,Classification,Classification,Uncertainty,-,-,-,Semi_supervised,Seed,-,-
2009,Semi-Supervised Active Learning for Sequence Labeling,ACL,https://aclanthology.org/P09-1117,Sequence_labeling,NER,Uncertainty,Partial,-,-,Semi_supervised,-,-,-
2009,A Combination of Active Learning and Semi-supervised Learning Starting with Positive and Unlabeled Examples for Word Sense Disambiguation: An Empirical Study on Japanese Web Search Query,ACL,https://aclanthology.org/P09-2016,Classification,WSD,Uncertainty,-,-,-,Semi_supervised,-,-,-
2009,Prototype-based Active Learning for Lemmatization,ACL,https://aclanthology.org/R09-1013,Classification,Others,Disagreement,-,-,-,-,-,-,-
2009,Active Learning of Extractive Reference Summaries for Lecture Speech Summarization,ACL,https://aclanthology.org/W09-3105,Sequence_labeling,Others,Others(special),-,-,-,-,-,-,-
2009,Sample Selection for Statistical Parsers: Cognitively Driven Algorithms and Evaluation Measures,ACL,https://aclanthology.org/W09-1103,Complex_structured_prediction,Parsing,Others(special),-,Measurement,-,-,-,-,-
2009,A Method for Stopping Active Learning Based on Stabilizing Predictions and the Need for User-Adjustable Stopping,ACL,https://aclanthology.org/W09-1107,"Classification,Sequence_labeling","Classification,NER",Uncertainty,-,-,-,-,-,Stop,-
2009,An Intrinsic Stopping Criterion for Committee-Based Active Learning,ACL,https://aclanthology.org/W09-1118,Sequence_labeling,NER,Disagreement,-,-,-,-,-,Stop,-
2009,Active Learning for Anaphora Resolution,ACL,https://aclanthology.org/W09-1901,Complex_structured_prediction,Coreference,Uncertainty,Partial,-,-,-,-,-,-
2009,On Proper Unit Selection in Active Learning: Co-Selection Effects for Named Entity Recognition,ACL,https://aclanthology.org/W09-1902,Sequence_labeling,NER,Uncertainty,Partial,-,-,-,Seed,-,Data_imbalance
2009,Estimating Annotation Cost for Active Learning in a Multi-Annotator Environment,ACL,https://aclanthology.org/W09-1903,Classification,Classification,Others,-,Measurement,-,-,-,-,-
2009,Data Quality from Crowdsourcing: A Study of Annotation Selection Criteria,ACL,https://aclanthology.org/W09-1904,Classification,Classification,Others,-,-,-,-,-,-,Crowdsourcing
2009,A Web Survey on the Use of Active Learning to Support Annotation of Text Data,ACL,https://aclanthology.org/W09-1906,Others,Others,Others,-,-,-,-,-,-,-
2009,Active Dual Supervision: Reducing the Cost of Annotating Examples and Features,ACL,https://aclanthology.org/W09-1907,Classification,Classification,Uncertainty,-,-,-,-,-,-,-
2009,Proactive Learning for Building Machine Translation Systems for Minority Languages,ACL,https://aclanthology.org/W09-1908,Generation,MT,Others,-,-,-,-,-,-,-
2009,Active Learning in Example-Based Machine Translation,ACL,https://aclanthology.org/W09-4633,Generation,MT,"Density,Others(special)",-,-,-,-,-,-,-
2008,Stopping Criteria for Active Learning of Named Entity Recognition,ACL,https://aclanthology.org/C08-1059,Classification,NER,Uncertainty,-,-,-,-,-,Stop,-
2008,Multi-Criteria-Based Strategy to Stop Active Learning for Data Annotation,ACL,https://aclanthology.org/C08-1142,Classification,"Classification,WSD",Uncertainty,-,-,-,-,-,Stop,-
2008,Active Learning with Sampling by Uncertainty and Density for Word Sense Disambiguation and Text Classification,ACL,https://aclanthology.org/C08-1143,Classification,"Classification,WSD","Uncertainty,Density,Hybrid(simple)",-,-,-,-,Seed,-,-
2008,An Analysis of Active Learning Strategies for Sequence Labeling Tasks,ACL,https://aclanthology.org/D08-1112,Sequence_labeling,NER,"Uncertainty,Disagreement,Gradient,Density,Hybrid(simple)",Full,-,-,-,-,-,-
2008,Multi-Task Active Learning for Linguistic Annotations,ACL,https://aclanthology.org/P08-1098,"Sequence_labeling,Complex_structured_prediction","NER,Parsing",Disagreement,-,-,-,-,-,-,Multiple_targets
2008,Active Sample Selection for Named Entity Transliteration,ACL,https://aclanthology.org/P08-2014,Complex_structured_prediction,Others,Others(special),-,-,-,-,-,-,-
2008,Assessing the Costs of Sampling Methods in Active Learning for Annotation,ACL,https://aclanthology.org/P08-2017,Sequence_labeling,POS,"Uncertainty,Disagreement",-,Measurement,-,-,-,-,-
2008,Active Learning with Confidence,ACL,https://aclanthology.org/P08-2059,Classification,Classification,Uncertainty,-,-,-,-,-,-,-
2008,Active Annotation in the LUNA Italian Corpus of Spontaneous Dialogues,ACL,https://aclanthology.org/L08-1494,Sequence_labeling,Others,Uncertainty,-,-,-,-,-,-,-
2008,Rapidly Deploying Grammar-Based Speech Applications with Active Learning and Back-off Grammars,ACL,https://aclanthology.org/W08-0108,Complex_structured_prediction,Others,Others(special),-,-,-,-,-,-,-
2008,Learning a Stopping Criterion for Active Learning for Word Sense Disambiguation and Text Classification,ACL,https://aclanthology.org/I08-1048,Classification,"Classification,WSD",Uncertainty,-,-,-,-,-,Stop,-
2008,Approximating Learning Curves for Active-Learning-Driven Annotation,ACL,https://aclanthology.org/L08-1208,Sequence_labeling,NER,Disagreement,-,-,-,-,-,Stop,-
2008,Assessing the Costs of Machine-Assisted Corpus Annotation through a User Study,ACL,https://aclanthology.org/L08-1367,Sequence_labeling,POS,Others,-,"Measurement,Directly_reducing_cost",-,-,-,-,-
2007,An Approach to Text Corpus Construction which Cuts Annotation Costs and Maintains Reusability of Annotated Data,ACL,https://aclanthology.org/D07-1051,Sequence_labeling,NER,Disagreement,-,-,Model_mismatch,-,-,Stop,-
2007,Active Learning for Word Sense Disambiguation with Methods for Addressing the Class Imbalance Problem,ACL,https://aclanthology.org/D07-1082,Classification,WSD,Uncertainty,-,-,-,-,-,Stop,Data_imbalance
2007,Domain Adaptation with Active Learning for Word Sense Disambiguation,ACL,https://aclanthology.org/P07-1007,Classification,WSD,Uncertainty,-,-,-,Transfer_learning,-,-,-
2007,Active Learning for the Identification of Nonliteral Language,ACL,https://aclanthology.org/W07-0104,Classification,WSD,Uncertainty,-,-,-,-,-,-,-
2007,Active Learning for Part-of-Speech Tagging: Accelerating Corpus Annotation,ACL,https://aclanthology.org/W07-1516,Sequence_labeling,POS,"Uncertainty,Disagreement",Full,-,-,-,-,-,-
2006,An Empirical Study of the Behavior of Active Learning for Word Sense Disambiguation,ACL,https://aclanthology.org/N06-1016,Classification,WSD,Uncertainty,-,-,-,-,-,-,-
2006,MMR-based Active Machine Learning for Bio Named Entity Recognition,ACL,https://aclanthology.org/N06-2018,Sequence_labeling,NER,"Uncertainty,Discriminative,Hybrid(simple)",Full,-,-,-,-,-,-
2006,Active Annotation,ACL,https://aclanthology.org/W06-2209,Sequence_labeling,NER,Uncertainty,-,Directly_reducing_cost,-,-,Seed,-,-
2005,Low cost portability for statistical machine transla- tion based in N-gram frequency and TF-IDF,ACL,https://aclanthology.org/2005.iwslt-1.7,Generation,MT,Discriminative,-,-,-,-,-,-,-
2005,Investigating the Effects of Selective Sampling on the Annotation Task,ACL,https://aclanthology.org/W05-0619,Sequence_labeling,NER,Disagreement,-,Measurement,-,-,-,-,-
2004,Sample Selection for Statistical Parsing,ACL,https://aclanthology.org/J04-3001,Complex_structured_prediction,Parsing,Uncertainty,Full,-,-,-,-,-,-
2004,Ensemble-based Active Learning for Parse Selection,ACL,https://aclanthology.org/N04-1012,Complex_structured_prediction,Parsing,"Uncertainty,Disagreement",-,-,-,-,-,-,-
2004,Multi-Criteria-based Active Learning for Named Entity Recognition,ACL,https://aclanthology.org/P04-1075,Sequence_labeling,NER,"Uncertainty,Density,Batch_diversity,Hybrid(simple),Hybrid(multi_step)",Partial,-,-,-,-,-,-
2004,Active Learning and the Total Cost of Annotation,ACL,https://aclanthology.org/W04-3202,Complex_structured_prediction,Parsing,Uncertainty,-,Directly_reducing_cost,Model_mismatch,-,-,-,-
2003,Active Learning for Classifying Phone Sequences from Unsupervised Phonotactic Models,ACL,https://aclanthology.org/N03-2007,Classification,Others,Uncertainty,-,-,-,-,-,-,-
2003,Active learning for HPSG parse selection,ACL,https://aclanthology.org/W03-0403,Complex_structured_prediction,Parsing,"Uncertainty,Disagreement",-,-,Model_mismatch,-,-,-,-
2002,Active Learning for Statistical Natural Language Parsing,ACL,https://aclanthology.org/P02-1016,Complex_structured_prediction,Parsing,"Uncertainty,Batch_diversity,Hybrid(multi_step)",Full,-,-,-,-,-,-
2002,An Empirical Study of Active Learning with Support Vector Machines forJapanese Word Segmentation,ACL,https://aclanthology.org/P02-1064,Sequence_labeling,Segmentation,Uncertainty,Partial,-,-,-,-,-,-
2001,Scaling to Very Very Large Corpora for Natural Language Disambiguation,ACL,https://aclanthology.org/P01-1005,Classification,Others,Disagreement,-,-,-,-,-,-,-
2000,Rule Writing or Annotation: Cost-efficient Resource Usage for Base Noun Phrase Chunking,ACL,https://aclanthology.org/P00-1016,Sequence_labeling,Segmentation,Disagreement,Full,Measurement,-,-,-,-,-
2000,Sample Selection for Statistical Grammar Induction,ACL,https://aclanthology.org/W00-1306,Complex_structured_prediction,Parsing,Uncertainty,Full,-,-,-,-,-,-
1998,Selective Sampling for Example-based Word Sense Disambiguation,ACL,https://aclanthology.org/J98-4002,Classification,WSD,Uncertainty,-,-,-,-,-,-,-
1996,Minimizing Manual Annotation Cost in Supervised Training from Corpora,ACL,https://aclanthology.org/P96-1042,Sequence_labeling,POS,Disagreement,-,-,-,-,-,-,-
2022,Active Learning Helps Pretrained Models Learn the Intended Task,cs.CL,-,Classification,"Others,Classification",Uncertainty,-,-,-,Transfer_learning,-,-,-
2022,Active Few-Shot Learning with FASL,cs.CL,-,Classification,Classification,Uncertainty,-,-,-,-,-,Stop,-
2022,Onception: Active Learning with Expert Advice for Real World Machine Translation,cs.CL,-,Generation,MT,"Disagreement,Others(special)",-,-,-,-,-,-,-
2022,Dominant Set-based Active Learning for Text Classification and its Application to Online Social Media,cs.CL,-,Classification,Social,"Uncertainty,Diversity",-,-,-,-,-,-,-
2022,Active Learning Over Multiple Domains in Natural Language Tasks,cs.CL,-,Classification,"Sentiment,Question_answering","Uncertainty,Discriminative",-,-,-,-,-,-,-
2022,Impact of Stop Sets on Stopping Active Learning for Text Classification,cs.CL,-,Classification,Classification,Uncertainty,-,-,-,-,-,Stop,-
2021,Hitting the Target: Stopping Active Learning at the Cost-Based Optimum,cs.CL,-,Others,Others,Others,-,-,-,-,-,Stop,-
2021,Active Learning for Event Extraction with Memory-based Loss Prediction Model,cs.CL,-,Sequence_labeling,Event,"Uncertainty,Diversity,Performance_prediction",-,-,-,-,-,-,-
2021,Diversity Enhanced Active Learning with Strictly Proper Scoring Rules,cs.CL,-,Classification,Classification,"Uncertainty,Diversity",-,-,-,-,-,-,-
2021,Single-Modal Entropy based Active Learning for Visual Question Answering,cs.CL,-,Classification,Visual_question_answering,"Uncertainty,Performance_prediction,Discriminative",-,-,-,-,-,-,-
2021,Active Learning for Argument Mining: A Practical Approach,cs.CL,-,Sequence_labeling,Discourse,"Uncertainty,Diversity",-,-,-,-,AL_stage,-,-
2021,Improving Question Answering Performance Using Knowledge Distillation and Active Learning,cs.CL,-,Sequence_labeling,Question_answering,"Uncertainty,Diversity",-,-,-,-,-,-,-
2021,Active learning for reducing labeling effort in text classification tasks,cs.CL,-,Classification,Classification,Uncertainty,-,-,-,-,-,-,-
2021,Deep Active Learning for Text Classification with Diverse Interpretations,cs.CL,-,Classification,Classification,"Diversity,Uncertainty",-,-,-,-,-,-,-
2021,Small-Text: Active Learning for Text Classification in Python,cs.CL,-,Classification,Classification,Others,-,-,-,-,-,-,Tools
2020,Active Learning from Crowd in Document Screening,cs.CL,-,Classification,Classification,Others,-,-,-,-,-,-,Crowdsourcing
2020,Medical symptom recognition from patient text: An active learning approach for long-tailed multilabel distributions,cs.CL,-,Classification,Classification,Diversity,-,-,-,-,-,-,Data_imbalance
2020,Exemplar Guided Active Learning,cs.CL,-,Classification,WSD,"Uncertainty,Representative",-,-,-,-,-,-,Data_imbalance
2020,Active Learning for Product Type Ontology Enhancement in E-commerce,cs.CL,-,Classification,Others,Others,-,-,-,-,-,-,-
2020,Cost-Quality Adaptive Active Learning for Chinese Clinical Named Entity Recognition,cs.CL,-,Sequence_labeling,NER,Uncertainty,-,Cost_sensitive,-,-,-,-,-
2020,A Survey of Active Learning for Text Classification using Deep Neural Networks,cs.CL,-,Others,Others,Others,-,-,-,-,-,-,-
2020,Active Learning for Video Description With Cluster-Regularized Ensemble Ranking,cs.CL,-,Generation,Others,"Uncertainty,Disagreement,Diversity",-,-,-,-,-,-,-
2020,"Annotating Social Determinants of Health Using Active Learning, and Characterizing Determinants Using Neural Event Extraction",cs.CL,-,Others,Event,"Uncertainty,Representative",-,-,-,-,-,-,-
2020,Integrating Crowdsourcing and Active Learning for Classification of Work-Life Events from Tweets,cs.CL,-,Classification,Social,"Uncertainty,Disagreement",-,-,-,-,-,-,Crowdsourcing
2020,Early Forecasting of Text Classification Accuracy and F-Measure with Active Learning,cs.CL,-,Classification,Classification,Others,-,-,-,-,-,Stop,-
2020,LTP: A New Active Learning Strategy for CRF-Based Named Entity Recognition,cs.CL,-,Sequence_labeling,NER,Uncertainty,-,-,-,-,-,-,-
2019,Deep Bayesian Active Learning for Multiple Correct Outputs,cs.CL,-,Generation,Visual_question_answering,Uncertainty,-,-,-,-,-,-,-
2019,Using Error Decay Prediction to Overcome Practical Issues of Deep Active Learning for Named Entity Recognition,cs.CL,-,Sequence_labeling,NER,"Performance_prediction,Representative",-,-,-,-,-,-,-
2019,NE-LP: Normalized Entropy and Loss Prediction based Sampling for Active Learning in Chinese Word Segmentation on EHRs,cs.CL,-,Sequence_labeling,Others,"Performance_prediction,Uncertainty",-,-,-,-,-,-,-
2019,Active Annotation: bootstrapping annotation lexicon and guidelines for supervised NLU learning,cs.CL,-,Classification,Others,Representative,-,-,-,-,-,-,-
2019,Privacy-preserving Active Learning on Sensitive Data for User Intent Classification,cs.CL,-,Classification,Others,Others(special),-,-,-,-,-,-,-
2019,The Use of Unlabeled Data versus Labeled Data for Stopping Active Learning for Text Classification,cs.CL,-,Classification,Classification,Uncertainty,-,-,-,-,-,Stop,-
2019,Stopping Active Learning based on Predicted Change of F Measure for Text Classification,cs.CL,-,Classification,Classification,Uncertainty,-,-,-,-,-,Stop,-
2018,"OpenTag: Open Attribute Value Extraction from Product Profiles [Deep Learning, Active Learning, Named Entity Recognition]",cs.CL,-,Sequence_labeling,NER,Disagreement,-,-,-,-,-,-,-
2018,Impact of Batch Size on Stopping Active Learning for Text Classification,cs.CL,-,Classification,Classification,Uncertainty,-,-,-,-,-,Stop,-
2017,Deep Active Learning for Named Entity Recognition,cs.CL,-,Sequence_labeling,NER,Uncertainty,-,-,-,-,-,-,-
2017,On Using Active Learning and Self-Training when Mining Performance Discussions on Stack Overflow,cs.CL,-,Classification,Classification,Uncertainty,-,-,-,Semi_supervised,-,-,-
2016,Active Learning for Speech Recognition: the Power of Gradients,cs.CL,-,Sequence_labeling,Others,Gradient,-,-,-,-,-,-,-
2016,Active Discriminative Text Representation Learning,cs.CL,-,Classification,Classification,Gradient,-,-,-,-,-,-,-
2009,Active Learning for Mention Detection: A Comparison of Sentence Selection Strategies,cs.CL,-,Sequence_labeling,NER,"Uncertainty,Disagreement",-,-,-,-,-,-,-
2022,A Comparative Survey of Deep Active Learning,Others,-,Classification,Others,Others,-,-,-,-,-,-,-
2022,Active Learning on Pre-trained Language Model with Task-Independent Triplet Loss,Others,-,"Classification,Complex_structured_prediction","Classification,Others",Diversity,-,-,-,-,-,-,-
2021,Batch Active Learning at Scale,Others,-,Classification,Others,Hybrid(multi_step),-,Wait_time,-,-,-,-,-
2021,DeepAL: Deep Active Learning in Python,Others,-,Others,Others,Others,-,-,-,-,-,-,Tools
2021,Multi-Domain Active Learning: A Comparative Study,Others,-,Classification,Others,Others,-,-,-,-,-,-,-
