Year,Title,Source,Link,Output,Task,Query,Structured,Cost,Model,Learning,Start,Stop,Others
2020,Active Learning: Problem Settings and Recent Developments,Others,-,Others,Others,Others,-,-,-,-,-,-,-
2020,Active adversarial domain adaptation,Others,-,Classification,Others,Discriminative,-,-,-,Transfer_learning,-,-,-
2020,"Query Strategies, Assemble! Active Learning with Expert Advice for Low-resource Natural Language Processing",Others,-,Sequence_labeling,Others,"Performance_prediction,Hybrid(dynamic)",-,-,-,-,-,-,-
2020,Active Learning Stopping Strategies for Technology-Assisted Sensitivity Review,Others,-,Others,Others,Others,-,-,-,-,-,Stop,-
2020,"Deep Batch Active Learning by Diverse, Uncertain Gradient Lower Bounds",Others,-,Others,Others,Hybrid(integrated),-,-,-,-,-,-,-
2020,Rethinking deep active learning: Using unlabeled data at model training,Others,-,Others,Others,Others,-,-,-,Semi_supervised,-,-,-
2020,Merging Weak and Active Supervision for Semantic Parsing,Others,-,Generation,Others,"Performance_prediction,Uncertainty,Batch_diversity",Partial,-,-,Weak_supervision,-,-,-
2019,Batch Active Learning Using Determinantal Point Processes,Others,-,Others,Others,"Uncertainty,Batch_diversity,Hybrid(integrated)",-,-,-,-,-,-,-
2019,Self-Paced Active Learning: Query the Right Thing at the Right Time,Others,-,Others,Others,Others(special),-,-,-,-,-,-,-
2019,Variational Adversarial Active Learning,Others,-,Others,Others,Discriminative,-,-,-,Semi_supervised,-,-,-
2019,Diverse mini-batch Active Learning,Others,-,Others,Others,"Batch_diversity,Hybrid(integrated)",-,-,-,-,-,-,-
2019,Discriminative Active Learning,Others,-,Others,Others,Discriminative,-,-,-,-,-,-,-
2019,Learning Loss for Active Learning,Others,-,Others,Others,Performance_prediction,-,-,-,-,-,-,-
2019,Active learning with partial feedback,Others,-,Classification,Classification,Others,Partial,Wait_time,-,-,-,-,-
2018,Adversarial active learning for deep networks: a margin based approach,Others,-,Others,Others,Uncertainty,-,-,-,-,-,-,-
2018,Adversarial active learning for sequence labeling and generation,Others,-,"Sequence_labeling,Generation",Others,Discriminative,-,-,-,-,-,-,-
2018,Active Learning for Neural Machine Translation,Others,-,Generation,MT,Others,-,-,-,-,-,-,-
2018,Active Learning for Convolutional Neural Networks: A Core-Set Approach,Others,-,Others,Others,"Uncertainty,Diversity",-,-,-,-,-,-,-
2017,Deep Active Learning over the Long Tail,Others,-,Others,Others,"Uncertainty,Diversity",-,-,-,-,AL_stage,-,-
2017,Active Learning for Black-Box Semantic Role Labeling with Neural Factors,Others,-,Others,SRL,Performance_prediction,-,-,-,Semi_supervised,-,-,-
2017,Cost-Effective Active Learning from Diverse Labelers,Others,-,Classification,Others,Uncertainty,-,Cost_sensitive,-,-,-,-,-
2017,Active Learning for Structured Prediction from Partially Labeled Data,Others,-,Others,Others,Others,Partial,-,-,-,-,-,-
2017,Learning algorithms for active learning,Others,-,Classification,Others,Performance_prediction,-,-,-,-,-,-,-
2017,Deep Bayesian Active Learning with Image Data,Others,-,Others,Others,Disagreement,-,-,-,-,-,-,-
2016,Dropout as a Bayesian Approximation: Representing Model Uncertainty in Deep Learning,Others,-,Others,Others,Others,-,-,-,-,-,-,-
2016,Re-active learning: Active learning with relabeling,Others,-,Others,Others,Others,-,-,-,-,-,-,-
2016,Cost-effective active learning for deep image classification,Others,-,Classification,Others,Others,-,-,-,Semi_supervised,-,-,-
2015,Active learning by learning,Others,-,Classification,Others,Performance_prediction,-,-,-,-,-,-,-
2015,A study of active learning methods for named entity recognition in clinical text,Others,-,Sequence_labeling,NER,Others,-,Measurement,-,-,-,-,-
2015,An active learning approach to coreference resolution,Others,-,Others,Coreference,Others,Partial,-,-,-,-,-,-
2013,Active learning for cross-domain sentiment classification,Others,-,Classification,Others,"Disagreement,Uncertainty",-,-,-,Transfer_learning,-,-,-
2014,Active learning for crowdsourcing using knowledge transfer,Others,-,Classification,Others,Others,-,-,-,Transfer_learning,-,-,Crowdsourcing
2013,Latent Structured Active Learning,Others,-,Others,Others,Others,Partial,-,-,Semi_supervised,-,-,-
2013,Class imbalance and active learning,Others,-,Classification,Others,Others,-,-,-,-,-,-,Data_imbalance
2012,Active learning for clinical text classification: is it better than random sampling?,Others,-,Others,Others,Others,-,-,-,-,-,-,-
2011,From theories to queries: Active learning in practice,Others,-,Others,Others,Others,-,-,-,-,-,-,-
2011,active supervised domain adaptation,Others,-,Classification,Classification,Uncertainty,-,-,-,Transfer_learning,-,-,-
2011,Bayesian active learning for classification and preference learning,Others,-,Others,Others,"Uncertainty,Disagreement",-,-,-,-,-,-,-
2011,Two faces of active learning,Others,-,Others,Others,Others,-,-,-,-,-,-,-
2011,Active learning from crowds,Others,-,Classification,Others,Uncertainty,-,-,-,-,-,-,Crowdsourcing
2011,Active learning with subsequence sampling strategy for sequence labeling tasks,Others,-,Sequence_labeling,"Others,NER",Uncertainty,Partial,-,-,-,-,-,-
2010,Off to a good start: Using clustering to select the initial training set in active learning,Others,-,Classification,Others,Uncertainty,-,-,-,-,Seed,-,-
2010,Active Learning With Sampling by Uncertainty and Density for Data Annotations,Others,-,Classification,"Classification,WSD","Uncertainty,Density,Hybrid(simple),Hybrid(multi_step)",-,Wait_time,-,-,-,-,-
2010,Inactive learning?: difficulties employing active learning in practice,Others,-,Others,Others,Others,-,-,-,-,-,-,-
2009,Active learning for object classification: from exploration to exploitation,Others,-,Classification,Others,"Uncertainty,Density,Hybrid(simple)",-,-,-,-,-,-,-
2009,Reducing Class Imbalance during Active Learning for Named Entity Annotation,Others,-,Classification,Others,Uncertainty,-,-,-,-,-,-,Data_imbalance
2008,Proactive Learning: Cost-Sensitive Active Learning with Multiple Imperfect Oracles,Others,-,Classification,Others,Uncertainty,-,Cost_sensitive,-,-,-,-,-
2008,Return on investment for active learning,Others,-,Sequence_labeling,POS,"Uncertainty,Disagreement",-,Cost_sensitive,-,-,-,-,-
2008,Actively transfer domain knowledge,Others,-,Classification,Others,Uncertainty,-,-,-,Transfer_learning,-,-,-
2008,Active learning with real annotation costs,Others,-,"Classification,Sequence_labeling",NER,Uncertainty,-,"Measurement,Cost_sensitive",-,-,-,-,-
2008,A stopping criterion for active learning,Others,-,"Classification,Sequence_labeling",Others,Uncertainty,-,-,-,-,-,Stop,-
2008,Active learning for pipeline models,Others,-,Complex_structured_prediction,Others,Uncertainty,Full,-,-,-,-,-,-
2007,Dual strategy active learning,Others,-,Classification,Others,Hybrid(dynamic),-,-,-,-,AL_stage,-,-
2007,Learning on the border: active learning in imbalanced data classification,Others,-,Classification,Others,Uncertainty,-,Wait_time,-,-,-,Stop,Data_imbalance
2007,Active learning for logistic regression: an evaluation,Others,-,Classification,Classification,"Uncertainty,Disagreement",-,-,-,-,-,-,-
2006,Margin-based active learning for structured output spaces,Others,-,Complex_structured_prediction,Others,Uncertainty,Partial,-,-,-,-,-,-
2005,Reducing labeling effort for structured prediction tasks,Others,-,Sequence_labeling,Others,Uncertainty,Full,"Measurement,Directly_reducing_cost",-,-,-,-,-
2004,Active Learning Using Pre-clustering,Others,-,Classification,Others,Representative,-,-,-,-,-,-,-
2004,Using cluster-based sampling to select initial training set for active learning in text classification,Others,-,Classification,Others,Uncertainty,-,-,-,-,Seed,-,-
2003,Representative sampling for text classification using support vector machines,Others,-,Classification,Others,Representative,-,-,-,-,-,-,-
2003,Incorporating diversity in active learning with support vector machines,Others,-,Classification,Others,Representative,-,-,-,-,-,-,-
2001,Active Hidden Markov Models for Information Extraction,Others,-,Sequence_labeling,Others,Uncertainty,Partial,-,-,-,-,-,-
2001,Support vector machine active learning with applications to text classification,Others,-,Classification,Others,Others,-,-,-,-,-,-,-
2001,Toward Optimal Active Learning through Sampling Estimation of Error Reduction,Others,-,Classification,Others,"Uncertainty,Performance_prediction",-,Wait_time,-,-,-,-,-
2000,Less is more: Active learning with support vector machines,Others,-,Classification,Others,Uncertainty,-,-,-,-,-,Stop,-
1999,Active learning for natural language parsing and information extraction,Others,-,Sequence_labeling,Others,Heuristic,-,-,-,-,-,-,-
1998,Employing EM and pool-based active learning for text classification,Others,-,Classification,Others,"Uncertainty,Representative",-,-,-,Semi_supervised,-,-,-
1996,Active learning with statistical models,Others,-,Others,Others,Others,-,-,-,-,-,-,-
1994,Improving generalization with active learning,Others,-,Others,Others,Disagreement,-,-,-,Semi_supervised,-,-,-
1994,Heterogeneous uncertainty sampling for supervised learning,Others,-,Others,Others,Others,-,-,Model_mismatch,-,-,-,-
1994,A sequential algorithm for training text classifiers,Others,-,Others,Others,Uncertainty,-,-,-,-,-,-,-
1992,Query by committee,Others,-,Others,Others,Disagreement,-,-,-,-,-,-,-
